"Preview","Subject","From","Date","Is Unread","Email Link"
"Jesse Jackson, Wuthering Heights &amp; curling (Issue #416) The new AI inflection point Jesse Jackson, Wuthering Heights &amp; curling (Issue #416) By The Medium Blog ∙ February 20, 2026 ∙ 4 min read ∙","The new AI inflection point","The Medium Newsletter <newsletters@medium.com>","2026-02-20T11:05:00Z","True","https://mail.google.com/mail/u/0/#inbox/19c7ab9aaed1f296"
"#measure 23202 members 🔥Your team has sent 330 messages recently 🎉2 more teammates have joined View all unread messages New messages in #google-analytics Lukas GrebeFebruary 19th at 2:24 AM Hey! Is","You've got 31 unread messages","""#measure (via Slack)"" <notification@slack.com>","2026-02-20T11:00:03Z","True","https://mail.google.com/mail/u/0/#inbox/19c7ab4ee69c8024"
"MyCareers Logo The Role of Positive Feedback Is Essential to Effective Leadership Hi Ira, Many managers believe that if no corrective feedback is given, everything must be fine. In reality, silence","Ira, The Role of Positive Feedback Is Essential to Effective Leadership","MyCareers <emma@applicants.mycareers.net>","2026-02-20T10:52:48Z","False","https://mail.google.com/mail/u/0/#inbox/19c7aae51063bbdf"
"See what&#39;s new on Instagram tay.5979, stevens_ultimate and others shared 3 photos. Open Instagram tay.5979 stevens_ultimate lindseyvonn 1 You have 1 notification you may not have seen. This message","criticalityco, see what's been happening on Instagram","Instagram <posts-recap@mail.instagram.com>","2026-02-20T10:37:51Z","True","https://mail.google.com/mail/u/0/#inbox/19c7aa0a3ada8bd9"
"Check out your recent credit insights ͏ ͏ ͏ ͏ ͏ ͏ ͏ ͏ ͏ ͏ ͏ ͏ ͏ ͏ ͏ ͏ ͏ ͏ ͏ ͏ ͏ ͏ ͏ ͏ ͏ ͏ ͏ ͏ ͏ ͏ ͏ ͏ ͏ ͏ ͏ ͏ ͏ ͏ ͏ ͏ ͏ ͏ ͏ ͏ ͏ ͏ ͏ ͏ ͏ ͏ ͏ ͏ ͏ ͏ ͏ ͏ ͏ ͏ ͏ ͏ ͏ ͏ ͏ ͏ ͏ ͏ ͏ ͏ ͏ ͏ ͏ ͏ ͏ ͏ ͏ ͏ ͏ ͏ ͏ ͏ ͏ ͏","Here's your latest Credit Summary","Chase Credit Journey <no.reply.alerts@chase.com>","2026-02-20T10:20:07Z","False","https://mail.google.com/mail/u/0/#inbox/19c7a906138d65a6"
"Hurry! Discounts available for a limited time direct From Shubert &amp; Nederlander Theatres. Broadway Tickets Great Deals On Broadway&#39;s Hottest Tickets! Hurry! Discounts available for a limited","Limited Time Deals For SCHMIGADOON, THE LOST BOYS, WICKED & More","BroadwayWorld <bwwoffers@updates.broadwayworld.com>","2026-02-20T06:10:34Z","False","https://mail.google.com/mail/u/0/#inbox/19c7a4384f8df6b9"
"Beste Dhr. Ira Seidman, Deze e-mail gaat over uw consult bij MoveWell. Hierbij ontvangt u de factuur voor uw consult bij MoveWell De factuur is bijgevoegd als bijlage. Hartelijke groet, Team MoveWell","De factuur voor uw consult","MoveWell <info@movewell.nl>","2026-02-20T07:35:05Z","False","https://mail.google.com/mail/u/0/#inbox/19c79f9556bf94c9"
"Ira Seidman Stories for Ira Seidman @iraseidman2·Become a member Medium daily digest Today&#39;s highlights Kalle Georgiev Kalle GeorgievinData Science Collective Bayes&#39; Theorem for Humans: The","Bayes’ Theorem for Humans: The Math Trick Behind Better Thinking | Kalle Georgiev in Data Science Collective","Medium Daily Digest <noreply@medium.com>","2026-02-20T06:40:00Z","False","https://mail.google.com/mail/u/0/#inbox/19c79c6d9feffaa2"
"If you are unable to see the message below, click here to view. Upcoming Events Near You Jesse Malin&#39;s Silver Manhattan Jesse Malin&#39;s Silver Manhattan Bowery Palace Through March 29 Only Buy","Briscoe, OMA, Jesse Malin's Silver Manhattan & More!","TicketWeb <weeklymix@engage.ticketmaster.com>","2026-02-20T01:11:46Z","False","https://mail.google.com/mail/u/0/#inbox/19c78cc9a275f6bc"
"Replit Animation just dropped, and tomorrow we&#39;re going live to show you how to create professional-grade videos and animations just by prompting in natural language. → Product launch videos →","Tomorrow: Vibecode Your Next Viral Video with Replit","Replit <contact@mail.replit.com>","2026-02-19T22:55:52Z","False","https://mail.google.com/mail/u/0/#inbox/19c781def8a6f3cb"
