"Preview","Subject","From","Date","Is Unread","Email Link"
"Also: Don&#39;t blame supermarkets for your expensive groceries The Economist July 20th 2026 The Economist Today Our best journalism, handpicked each day desktop mobile Annie Crabill Senior digital","Boomers have the good life, but it could be longer","The Economist Today <newsletters@e.economist.com>","2026-07-20T20:49:49Z","False","https://mail.google.com/mail/u/0/#inbox/19f814d723d3fb72"
"From $59–$95: Two Strangers, Cats, Gatsby &amp; more. Your perfect summer night awaits on stage. Image Cool off this summer, take in a Broadway Show! Two Strangers (Carry a Cake Across New York) Two","Your Summer Needs Broadway Magic ✨","BWW Offers <bwwoffers@updates.broadwayworld.com>","2026-07-20T18:04:51Z","False","https://mail.google.com/mail/u/0/#inbox/19f80b3bfb24e379"
"Plus: cartoons from this week&#39;s issue. View in your browser | Update your preferences The New Yorker Daily Humor New Yorker subscribers exclusively enjoy complete access to our cartoon archives,","I Give My Kid the Talk","New Yorker Humor <newyorker@newsletter.newyorker.com>","2026-07-20T17:02:16Z","False","https://mail.google.com/mail/u/0/#inbox/19f807a8c465a1e1"
"right after you read this email ͏ ͏ ͏ ͏ ͏ ͏ ͏ ͏ ͏ ͏ ͏ ͏ ͏ ͏ ͏ ͏ ͏ ͏ ͏ ͏ ͏ ͏ ͏ ͏ ͏ ͏ ͏ ͏ ͏ ͏ ͏ ͏ ͏ ͏ ͏ ͏ ͏ ͏ ͏ ͏ ͏ ͏ ͏ ͏ ͏ ͏ ͏ ͏ ͏ ͏ ͏ ͏ ͏ ͏ ͏ ͏ ͏ ͏ ͏ ͏ ͏ ͏ ͏ ͏ ͏ ͏ ͏ ͏ ͏ ͏ ͏ ͏ ͏ ͏ ͏ ͏ ͏ ͏ ͏ ͏ ͏ ͏ ͏ ͏ ͏","Put your phone down","Hey Purpose <team@mail.purpose.app>","2026-07-20T15:01:30Z","False","https://mail.google.com/mail/u/0/#inbox/19f800bfdb91ea0f"
"View this issue on CodePen Melting Text, Scattered Words, and JS Stretch Effects This week&#39;s CodePen community highlights include a summery melted text effect from Vivi Tseng, chaotically scattered","Melting Text, Scattered Words, and JS Stretch Effects","CodePen <support@codepen.io>","2026-07-20T14:29:22Z","False","https://mail.google.com/mail/u/0/#inbox/19f7feecd15175d1"
"Summer break is winding down. Confirm your transportation early. ‌ ‌ ‌ ‌ ‌ ‌ ‌ ‌ ‌ ‌ ‌ ‌ ‌ ‌ ‌ ‌ ‌ ‌ ‌ ‌ ‌ ‌ ‌ ‌ ‌ ‌ ‌ ‌ ‌ ‌ ‌ ‌ ‌ ‌ ‌ ‌ ‌ ‌ ‌ ‌ ‌ ‌ ‌ ‌ ‌ ‌ ‌ ‌ ‌ ‌ ‌ ‌ ‌ ‌ ‌ ‌ ‌ ‌ ‌ ‌ ‌ ‌ ‌ ‌ ‌ ‌ ‌ ‌","Back to Campus? Plan Your Airport Ride","Groome Transportation <noreply@simon-mail.groometransportation.com>","2026-07-20T14:09:09Z","False","https://mail.google.com/mail/u/0/#inbox/19f7fdbf76303b86"
"New people to discover Suggested accounts based on your interests: plantpro.co, kyleboberg, and 4 others. Open Instagram Suggested for you See all PlantPro | Trusted Plant Care 🪴 plantpro.co Followed","criticalityco, see plantpro.co, kyleboberg and more in your feed","Instagram <follow-suggestions@mail.instagram.com>","2026-07-20T14:07:40Z","False","https://mail.google.com/mail/u/0/#inbox/19f7fdab752be560"
"Utilize design features &amp; embrace the power of PartSupply If you are unable to view this message correctly, click here Design Smarter Machines with SOLIDWORKS Designing machinery is a difficult","Watch Now to Design Smarter Machines with SOLIDWORKS","SOLIDWORKS <solidworks@community.3ds.com>","2026-07-20T13:30:57Z","False","https://mail.google.com/mail/u/0/#inbox/19f7fb9076c71737"
"50 Brooklyn neighbors are talking about this͏ ͏ ͏ ͏ ͏ ͏ ͏ ͏ ͏ ͏ ͏ ͏ ͏ ͏ ͏ ͏ ͏ ͏ ͏ ͏ ͏ ͏ ͏ ͏ ͏ ͏ ͏ ͏ ͏ ͏ ͏ ͏ ͏ ͏ ͏ ͏ ͏ ͏ ͏ ͏ ͏ ͏ ͏ ͏ ͏ ͏ ͏ ͏ ͏ ͏ ͏ ͏ ͏ ͏ ͏ ͏ ͏ ͏ ͏ ͏ ͏ ͏ ͏ ͏ ͏ ͏ ͏ ͏ ͏ ͏ ͏ ͏ ͏ ͏ ͏ ͏ ͏ ͏ ͏","🍦 What’s the best ice cream spot around Brooklyn that’s worth the trip?","""Bushwick S (Evergreen-Greene) Trending Posts"" <reply@rs.email.nextdoor.com>","2026-07-20T11:51:41Z","False","https://mail.google.com/mail/u/0/#inbox/19f7f5e1d2b727f2"
"Plus, war updates and the World Cup final. View in browser|nytimes.com July 20, 2026 Author Headshot By Sam Sifton Good morning. A third US service member died this weekend during intense exchanges","The Morning: Your questions, answered","The New York Times <nytdirect@nytimes.com>","2026-07-20T10:54:56Z","False","https://mail.google.com/mail/u/0/#inbox/19f7f2a6f19226ae"
