"Preview","Subject","From","Date","Is Unread","Email Link"
"Ira Seidman Stories for Ira Seidman @iraseidman2·Become a member Medium daily digest Today&#39;s highlights Anirban Mukherjee Anirban Mukherjee H₀ Has 14 Definitions. Most Data Scientists Know One. H₀","H₀ Has 14 Definitions. Most Data Scientists Know One. | Anirban Mukherjee","Medium Daily Digest <noreply@medium.com>","2026-05-11T05:00:00Z","False","https://mail.google.com/mail/u/0/#inbox/19e15683aef40668"
"See what&#39;s new on Instagram stevens_ultimate, lindseyvonn and others shared 6 photos. Open Instagram stevens_ultimate lindseyvonn thombrowne teamusa 1 You have 1 notification you may not have seen.","criticalityco, see what's been happening on Instagram","Instagram <posts-recap@mail.instagram.com>","2026-05-10T20:54:10Z","True","https://mail.google.com/mail/u/0/#inbox/19e13ab526881d18"
"Spend and earn rewards with a Capital One Business card. ͏ ͏ ͏ ͏ ͏ ͏ ͏ ͏ ͏ ͏ ͏ ͏ ͏ ͏ ͏ ͏ ͏ ͏ ͏ ͏ ͏ ͏ ͏ ͏ ͏ ͏ ͏ ͏ ͏ ͏ ͏ ͏ ͏ ͏ ͏ ͏ ͏ ͏ ͏ ͏ ͏ ͏ ͏ ͏ ͏ ͏ ͏ ͏ ͏ ͏ ͏ ͏ ͏ ͏ ͏ ͏ ͏ ͏ ͏ ͏ ͏ ͏ ͏ ͏ ͏ ͏ ͏ ͏ ͏ ͏ ͏ ͏","Keep business buys separate and maximize your rewards","Capital One <capitalone@message.capitalone.com>","2026-05-10T20:15:25Z","True","https://mail.google.com/mail/u/0/#inbox/19e1387ca7c3a11b"
"See what your neighbors are talking about͏ ͏ ͏ ͏ ͏ ͏ ͏ ͏ ͏ ͏ ͏ ͏ ͏ ͏ ͏ ͏ ͏ ͏ ͏ ͏ ͏ ͏ ͏ ͏ ͏ ͏ ͏ ͏ ͏ ͏ ͏ ͏ ͏ ͏ ͏ ͏ ͏ ͏ ͏ ͏ ͏ ͏ ͏ ͏ ͏ ͏ ͏ ͏ ͏ ͏ ͏ ͏ ͏ ͏ ͏ ͏ ͏ ͏ ͏ ͏ ͏ ͏ ͏ ͏ ͏ ͏ ͏ ͏ ͏ ͏ ͏ ͏ ͏ ͏ ͏ ͏ ͏ ͏ ͏ ͏","Trending in your area today 👀: Good morning neighbors today I lay my mom to...","Trending on Nextdoor <no-reply@rs.email.nextdoor.com>","2026-05-10T19:50:20Z","True","https://mail.google.com/mail/u/0/#inbox/19e1370d1e4fb897"
"Also: Russia is stumbling on the battlefield The Economist May 10th 2026 The Economist Today A Sunday edition of our daily newsletter desktop mobile Brooke Unger Senior digital editor The Iran war is","America faces a grocery-price shock. How bad could it get?","The Economist Today <newsletters@e.economist.com>","2026-05-10T18:46:40Z","False","https://mail.google.com/mail/u/0/#inbox/19e133690b7a1707"
"What&#39;s your favorite trail around Brooklyn? For a quiet walk, a workout, or a scenic view. Share your spot with neighbors͏ ͏ ͏ ͏ ͏ ͏ ͏ ͏ ͏ ͏ ͏ ͏ ͏ ͏ ͏ ͏ ͏ ͏ ͏ ͏ ͏ ͏ ͏ ͏ ͏ ͏ ͏ ͏ ͏ ͏ ͏ ͏ ͏ ͏ ͏ ͏ ͏ ͏","Ask Brooklyn started a conversation on May 7","""Bushwick S (Evergreen-Greene) Trending Posts"" <reply@rs.email.nextdoor.com>","2026-05-10T17:50:41Z","True","https://mail.google.com/mail/u/0/#inbox/19e130342bbb5707"
"Awesome—you successfully redeemed your rewards for a statement credit. ͏ ͏ ͏ ͏ ͏ ͏ ͏ ͏ ͏ ͏ ͏ ͏ ͏ ͏ ͏ ͏ ͏ ͏ ͏ ͏ ͏ ͏ ͏ ͏ ͏ ͏ ͏ ͏ ͏ ͏ ͏ ͏ ͏ ͏ ͏ ͏ ͏ ͏ ͏ ͏ ͏ ͏ ͏ ͏ ͏ ͏ ͏ ͏ ͏ ͏ ͏ ͏ ͏ ͏ ͏ ͏ ͏ ͏ ͏ ͏ ͏ ͏ ͏ ͏ ͏","Your $5.14 statement credit is on the way!","""Capital One | Quicksilver"" <capitalone@notification.capitalone.com>","2026-05-10T16:03:41Z","False","https://mail.google.com/mail/u/0/#inbox/19e12a14ed17ca62"
"Your Statement Credit is being processed. IRA SEIDMAN Account ending: 51003 Thank you for using Reward Dollars! Your Statement Credit is being processed. Details about your order are displayed below.","Thank you for using Reward Dollars!","American Express <AmericanExpress@welcome.americanexpress.com>","2026-05-10T15:56:51Z","False","https://mail.google.com/mail/u/0/#inbox/19e129b0aaf62c32"
"Security alert You signed in with a new device You successfully validated your device and signed in. Here are the details: Device: OS X - Brave When: May 10, 2026 at 11:54 AM ET Possible reasons you","Chase security alert: You signed in with a new device","Chase <no.reply.alerts@chase.com>","2026-05-10T15:54:37Z","False","https://mail.google.com/mail/u/0/#inbox/19e1299068b6df1a"
"Weekly New York City News BroadwayWorld New York City Weekly May. 10, 2026 26th Havana Film Festival NY Names Best Film and Documentary Winners 26th Havana Film Festival NY Names Best Film and","Weekly New York City News - 26th Havana Film Festival NY Names Best Film and Documentary Winners & More","BroadwayWorld New York City Weekly <newsletter@updates.broadwayworld.com>","2026-05-10T14:49:09Z","False","https://mail.google.com/mail/u/0/#inbox/19e1264a07db1765"
