"from","subject","date"
"=?UTF-8?B?RGlzY292ZXI=?= <discover@card-e.em.discover.com>","Ira, want to review your offer one more time?","Wed, 1 Jul 2026 20:09:51 +0000"
"New York State Education Department <nysednews@nysed.gov>","News & Notes: Transforming Education in New York State","Wed, 1 Jul 2026 16:07:28 -0400 (EDT)"
"Romemu <info@romemu.org>","Your High Holy Days Seats Are Waiting—Join or Renew Before Summer Ends","Wed, 1 Jul 2026 14:37:43 -0400 (EDT)"
"Sahil Bloom's Curiosity Chronicle <sahil@sahilbloom.com>","A Billionaire's Lesson I Can't Stop Thinking About","Wed, 01 Jul 2026 13:06:15 +0000 (UTC)"
"Romemu <info@romemu.org>","Services Moving to Hostel; Hesed for our Ops Team; Holy Day
 Registration; & More","Tue, 30 Jun 2026 15:40:53 -0400 (EDT)"
"""American Express"" <AmericanExpress@welcome.americanexpress.com>","We processed your payment","Tue, 30 Jun 2026 09:06:54 -0700"
"Lionel Seidman <lionelseidman1@gmail.com>","Re: Spritz Feed Next Steps Proposal","Tue, 30 Jun 2026 01:45:28 -0400"
"Clasp <NoReply_Clasp@channel.youronlineaccount.com>","Time-Sensitive: Action Needed on Your Clasp Account","Mon, 29 Jun 2026 17:38:54 +0000"
"Clasp <NoReply_Clasp@channel.youronlineaccount.com>","Payment Reminder for your Clasp Account","Mon, 29 Jun 2026 17:09:39 +0000"
"=?utf-8?Q?Mercury?= <hello@mercury.com>","Humanity Education Ventures sent you $1,900.00","Mon, 29 Jun 2026 13:20:34 +0000"
