"from","subject","date"
"noreply idw <noreply@idw.nl>","Betaalverzoek PR2026000874","Wed, 28 Jan 2026 12:58:55 +0000"
"Do Not Reply <donotreply@studentclearinghouse.org>","Transcript Order #91127612: Electronic Transcript Retrieved","Wed, 28 Jan 2026 07:57:00 -0500 (EST)"
"Sahil Bloom's Curiosity Chronicle <sahil@sahilbloom.com>","I Went On A Think ","Wed, 28 Jan 2026 10:03:00 +0000 (UTC)"
"""a.s.r."" <no-reply@asr.nl>","a.s.r. heeft een nieuw document Inschrijvingen met terugwerkende
 kracht in uw postvak geplaatst","28 Jan 2026 10:04:20 +0100"
"""a.s.r."" <no-reply@asr.nl>","a.s.r. heeft een nieuw document Aanvullingsverzoek Aanmelding in uw
 postvak geplaatst","6 Jan 2026 15:04:23 +0100"
"Casper Rosenvinge <casper@brandbassador.com>","Invitation: GA Sync @ Wed 28 Jan 2026 11:30 - 12:00 (CET) (ira.seidman@yahoo.com)","Wed, 28 Jan 2026 08:29:33 +0000"
"American Express <DoNotReplyUS@welcome.americanexpress.com>","Your AutoPay Payment Reminder","Tue, 27 Jan 2026 16:25:25 -0700"
"Romemu <info@romemu.org>","Minnesota; State of World Jewry Tix Last Chance; Purim; & More","Tue, 27 Jan 2026 17:46:05 -0500 (EST)"
"Romemu <info@romemu.org>","Honoring Holocaust Remembrance Day","Tue, 27 Jan 2026 16:36:46 -0500 (EST)"
"Romemu Brooklyn <hellobrooklyn@romemu.org>","An Update Regarding Jess Lehmann Ash's Brother's Shiva","Tue, 27 Jan 2026 16:00:39 -0500 (EST)"
